{
  "$schema": "https://json-schema.org/draft/2020-12/schema",
  "$id": "https://jevsor.dev/schemas/response.json",
  "title": "jevsor response",
  "type": "object",
  "additionalProperties": true,
  "required": ["model", "answers", "usage"],
  "properties": {
    "model": { "type": "string" },
    "answers": {
      "type": "object",
      "minProperties": 1,
      "additionalProperties": {
        "type": "object",
        "required": ["type"],
        "properties": {
          "type": { "enum": ["choice", "score", "noul"] },
          "choice": { "type": "string" },
          "score": { "type": "number" },
          "noul": { "type": "number", "minimum": 0, "maximum": 1 },
          "probabilities": {
            "type": "object",
            "additionalProperties": { "type": "number" }
          },
          "confidence": { "type": "number", "minimum": 0, "maximum": 1 },
          "provenance": { "enum": ["measured", "prompted"] },
          "truncated": { "type": "boolean" },
          "missing_mass": { "type": "number", "minimum": 0, "maximum": 1 }
        }
      }
    },
    "usage": {
      "type": "object",
      "required": ["input_tokens", "output_tokens"],
      "properties": {
        "input_tokens": { "type": "integer", "minimum": 0 },
        "output_tokens": { "type": "integer", "minimum": 0 }
      }
    },
    "debug": { "type": "object" },
    "mixed_provenance": { "type": "boolean" }
  }
}
